Model,Best_nof_features,Best_train_score,Best_val_score,Score_Diff,Selected_features
DecisionTree,10,0.7787661533014693,0.7662927024719962,0.012473450829473043,"Average Weekly Wage, IME-4 Count, WCIO Nature of Injury Code, missing_First Hearing Date, Time To First Hearing, Time to C-2 Date, Economic Impact, IME-4 / Economic Impact, Attorney_Representative_Y, Dispute_and_Rep_N_Y"
ExtraTreesClassifier,80,1.0,0.741651133216034,0.25834886678396596,"Age at Injury, Average Weekly Wage, Birth Year, Carrier Name, Carrier Type, Claim Identifier, County of Injury, District Name, IME-4 Count, Industry Code, Industry Code Description, WCIO Cause of Injury Code, WCIO Cause of Injury Description, WCIO Nature of Injury Code, WCIO Nature of Injury Description, WCIO Part Of Body Code, WCIO Part Of Body Description, Zip Code, Number of Dependents, missing_C-2 Date, missing_C-3 Date, missing_First Hearing Date, missing_IME-4_Count, missing_Zip_Code, missing_Birth_Year, Time To Assembly, Time To First Hearing, Time to C-2 Date, Time to C-3 Date, Age Group, Industry Risk, Economic Impact, Log Average Weekly Wage, Average Weekly Wage Squared, Average Weekly Wage Sqrt, Log IME-4 Count, IME-4 Count Squared, IME-4 Count Sqrt, Wage * Economic Impact, IME-4 / Economic Impact, COVID and Industry, Injury Type Combined, Alternative Dispute Resolution_Y, Attorney_Representative_Y, COVID-19 Indicator_Y, Gender_M, Medical Fee Region_II, Medical Fee Region_III, Medical Fee Region_IV, Medical Fee Region_UK, Dispute_and_Rep_N_Y, Accident Date_Year, Accident Date_Day, Accident Date_DayOfWeek, Accident Date_IsWeekend, Assembly Date_Year, Assembly Date_Day, Assembly Date_DayOfWeek, C-2 Date_Year, C-2 Date_Day, C-2 Date_DayOfWeek, C-2 Date_IsWeekend, C-3 Date_Year, C-3 Date_Day, C-3 Date_DayOfWeek, C-3 Date_IsWeekend, First Hearing Date_Year, First Hearing Date_Month, First Hearing Date_Day, First Hearing Date_DayOfWeek, Accident Season Sin, Accident Season Cos, Accident Month Sin, Accident Month Cos, Assembly Month Sin, Assembly Month Cos, C-2 Month Sin, C-2 Month Cos, C-3 Month Sin, C-3 Month Cos"
GradientBoostingClassifier,10,0.5177465038059833,0.5069508562270265,0.01079564757895679,"Carrier Type, missing_First Hearing Date, Time To First Hearing, Time to C-2 Date, Time to C-3 Date, Log Average Weekly Wage, Wage * Economic Impact, IME-4 / Economic Impact, Injury Type Combined, Dispute_and_Rep_N_Y"
LightGBMClassifier,50,0.8894937157018942,0.7345260700660244,0.15496764563586973,"Age at Injury, Average Weekly Wage, Birth Year, Carrier Name, Carrier Type, Claim Identifier, County of Injury, District Name, IME-4 Count, Industry Code, Industry Code Description, WCIO Cause of Injury Code, WCIO Cause of Injury Description, WCIO Nature of Injury Code, WCIO Nature of Injury Description, WCIO Part Of Body Code, WCIO Part Of Body Description, Zip Code, Number of Dependents, missing_First Hearing Date, missing_IME-4_Count, Time To Assembly, Time To First Hearing, Time to C-2 Date, Time to C-3 Date, Economic Impact, Log Average Weekly Wage, Wage * Economic Impact, IME-4 / Economic Impact, COVID and Industry, Injury Type Combined, Dispute_and_Rep_N_Y, Accident Date_Day, Accident Date_DayOfWeek, Assembly Date_Day, Assembly Date_DayOfWeek, C-2 Date_Day, C-2 Date_DayOfWeek, C-3 Date_Day, First Hearing Date_Year, First Hearing Date_Month, First Hearing Date_Day, First Hearing Date_DayOfWeek, Accident Month Sin, Accident Month Cos, Assembly Month Sin, Assembly Month Cos, C-2 Month Sin, C-2 Month Cos, C-3 Month Sin"
RandomForestClassifier,20,0.9844662772172066,0.7081772729648276,0.276289004252379,"Age at Injury, Birth Year, Carrier Name, Claim Identifier, County of Injury, WCIO Cause of Injury Description, WCIO Part Of Body Code, Zip Code, Time To Assembly, Time To First Hearing, Time to C-2 Date, Time to C-3 Date, Log Average Weekly Wage, Average Weekly Wage Squared, Average Weekly Wage Sqrt, Wage * Economic Impact, Injury Type Combined, Dispute_and_Rep_N_Y, Accident Date_Day, Assembly Date_Day"
XGBoostClassifier,10,0.7960701009028146,0.759968991167709,0.03610110973510561,"Average Weekly Wage, IME-4 Count, WCIO Nature of Injury Code, missing_First Hearing Date, missing_IME-4_Count, IME-4 / Economic Impact, Alternative Dispute Resolution_Y, Attorney_Representative_Y, COVID-19 Indicator_Y, Dispute_and_Rep_N_Y"
